角色名,唱法/表演方式,台词,来源文件,字数,情感分
关羽,白,且住，后面烟尘四起，定是曹兵追赶前来。马童，保护车辆，往大路前行；曹兵追赶，休得害怕。你爷独挡曹兵。,qianlizoudanqi.csv,41,0.9
关羽,白,然。,qianlizoudanqi.csv,1,0.55
关羽,白,"秦琪，一派胡言！放马过来！
渡我们过去。",qianlizoudanqi.csv,15,0.55
关羽,白,什么？,qianlizoudanqi.csv,2,0.55
关羽,白,无有文凭路引。,qianlizoudanqi.csv,6,0.55
关羽,白,"马童，将车辆打至松林，歇息歇息，再作道理。
《古城会》",qianlizoudanqi.csv,20,0.1
关羽,内西皮导板,离却曹营奔阳关，,qianlizoudanqi.csv,7,0.55
关羽,西皮原板,"日行夜宿哪得安。
过黄河斩秦琪路遇文远，
一路来斩六将闯出五关。",qianlizoudanqi.csv,27,0.30000000000000004
关羽,白,言得极是，马童将车辆打入松林，歇息歇息再行。,qianlizoudanqi.csv,19,0.1
关羽,白,参见二位嫂嫂。,qianlizoudanqi.csv,6,0.55
关羽,白,谢嫂嫂。,qianlizoudanqi.csv,3,0.9
关羽,白,弟何足道哉！一路之上二嫂多受惊恐。,qianlizoudanqi.csv,15,0.1
关羽,白,"二嫂休要落泪，小弟在此，料无妨碍。请至松林后面。
马童。",qianlizoudanqi.csv,22,0.55
关羽,白,命你去到古城，打听大爷可在？,qianlizoudanqi.csv,12,0.1
关羽,白,转来。,qianlizoudanqi.csv,2,0.55
关羽,白,若遇三爷，你要小心了。,qianlizoudanqi.csv,9,0.55
关羽,白,正是：,qianlizoudanqi.csv,2,0.9
关羽,念,不辞千里路，特来会弟兄。,qianlizoudanqi.csv,10,0.55
关羽,念,曹营十二载，古城又相逢。,qianlizoudanqi.csv,10,0.55
关羽,白,你家三爷可好？,qianlizoudanqi.csv,6,0.55
关羽,白,他言讲什么？,qianlizoudanqi.csv,5,0.55
关羽,白,难道你不知二爷的苦衷么？,qianlizoudanqi.csv,11,0.55
关羽,白,你讲些什么？,qianlizoudanqi.csv,5,0.55
关羽,白,难道你白白地就等死不成？,qianlizoudanqi.csv,11,0.55
关羽,白,"嗯！
我三弟还是这样莽撞！马童！",qianlizoudanqi.csv,12,0.55
关羽,白,带马！,qianlizoudanqi.csv,2,0.55
关羽,白,三弟为何提枪便剌？,qianlizoudanqi.csv,8,0.55
关羽,白,怎见得愚兄降曹？,qianlizoudanqi.csv,7,0.55
关羽,白,三弟可知愚兄斩颜、文二将之故？,qianlizoudanqi.csv,13,0.1
关羽,白,你恨着何来？,qianlizoudanqi.csv,5,0.1
关羽,白,你当真不认愚兄？,qianlizoudanqi.csv,7,0.55
关羽,白,你果然不认愚兄？,qianlizoudanqi.csv,7,0.55
关羽,白,三弟，桃园桔义天下皆知；若是弟兄厮杀，岂不被人耻笑！你可打开古城，迎请二嫂进城，自刎头落一死。,qianlizoudanqi.csv,40,0.23333333333333334
关羽,白,罢，罢，罢！,qianlizoudanqi.csv,3,0.55
关羽,西皮导板,勒马停缰珠泪掉，,qianlizoudanqi.csv,7,0.55
关羽,西皮快二六板,"青龙刀斜跨在马鞍桥。
曹孟德虽待我恩高义好，
上马金下马银美酒红袍。
官封到汉寿亭侯我的爵禄不小，
难道说大丈夫忘却了当年的旧故交？
今日里在古城我们弟兄会了，
三兄弟全不念我们桃园结交。
罢罢罢，忍耐了，
弟兄恩义就一旦抛。
下得马去把头斫，4",qianlizoudanqi.csv,102,0.9
关羽,西皮散板,桃园失义在今朝。,qianlizoudanqi.csv,7,0.9
关羽,白,起来。,qianlizoudanqi.csv,2,0.55
关羽,白,打开古城，迎请二嫂进城。,qianlizoudanqi.csv,10,0.1
关羽,白,嗯——,qianlizoudanqi.csv,1,0.55
关羽,白,你我一同上马。,qianlizoudanqi.csv,6,0.55
关羽,白,"马童带马！
三弟为何将城门紧闭？",qianlizoudanqi.csv,13,0.55
关羽,白,何出此言？,qianlizoudanqi.csv,4,0.55
关羽,白,三弟！此乃蔡阳人马，追赶前来，要与他外甥秦琪报仇。三弟打开古城，愚兄进得城去，歇息歇息，好力斩蔡阳。,qianlizoudanqi.csv,42,0.1
关羽,白,难道你不念桃园结义……,qianlizoudanqi.csv,9,0.9
关羽,白,三弟，愚兄过关斩将，力竭精疲，还望三弟多赐人马为是。,qianlizoudanqi.csv,22,0.1
关羽,白,好，马童，杀！,qianlizoudanqi.csv,4,0.1
关羽,白,然。,qianlizoudanqi.csv,1,0.55
关羽,白,蔡阳！如此逼迫，恕关某无礼了。,qianlizoudanqi.csv,12,0.9
关羽,白,大哥，丞相好意相请，小亭筵宴，酒要少饮，休要失了礼貌。,qingmeizhujiulunyingxiong.csv,22,0.9
关羽,白,"吾二人闻听兄长和丞相小亭饮酒，特来舞剑，以助——
一笑。",qingmeizhujiulunyingxiong.csv,22,0.9
关羽,同白,谢丞相！,qingmeizhujiulunyingxiong.csv,3,0.9
关羽,内二黄导板,想当年辅汉室忠心扶保，,QingShiShan.csv,10,0.9
关羽,锁呐二黄慢板,"恼恨那小妖魔搅乱吾朝。
今有那吕法官牒文来到，
因此上带神将收伏此妖。",QingShiShan.csv,30,0.1
关羽,念,蚕眉赤脸美髯飘，红光日照偃月刀。跨下赤兔胭脂马，一片忠心保天曹。,QingShiShan.csv,28,0.9
关羽,白,"今有青石山妖魔作乱，吕仙有牒相邀，前去降妖。
众神将，驾起祥云，青石山去者！",QingShiShan.csv,31,0.5
关羽,白,吕仙相邀，有何见谕？,QingShiShan.csv,8,0.55
关羽,白,法官端坐，看某降妖。,QingShiShan.csv,8,0.55
关羽,白,众神将，撒下天罗天网！,QingShiShan.csv,9,0.55
关羽,白,驾起祥云，回复上帝去者！,QingShiShan.csv,10,0.9
关羽,同白,请！,QuFanCheng.csv,1,0.55
关羽,同白,遵命！,QuFanCheng.csv,2,0.55
关羽,白,遵命！,QuFanCheng.csv,2,0.55
关羽,白,前道为何不行？,QuFanCheng.csv,6,0.55
关羽,白,人马列开！,QuFanCheng.csv,4,0.55
关羽,白,前去叫关，就说本帅曹仁回关，叫他们快些开城。,QuFanCheng.csv,19,0.9
关羽,白,杀！,QuFanCheng.csv,1,0.1
关羽,内白,开关！,QuFanCheng.csv,2,0.55
关羽,白,关某在此。,QuFanCheng.csv,4,0.55
关羽,白,败兵不可追赶。人马进城！,QuFanCheng.csv,10,0.1
关羽,白,"待某差人报与主公知道。
众将官，紧守城池，曹兵至此，报我知道。安抚樊城黎民。掩门！",QuFanCheng.csv,33,0.9
关羽,同白,遵命！,SanGuMaoLu (2).csv,2,0.55
关羽,白,三弟！,SanGuMaoLu (2).csv,2,0.55
关羽,白,贤弟进入，仔细讲话，不可莽撞！,SanGuMaoLu (2).csv,12,0.55
关羽,白,小心了！,SanGuMaoLu (2).csv,3,0.55
关羽,白,兄长，相请卧龙先生怎么样了？,SanGuMaoLu (2).csv,12,0.55
关羽,白,如此，兄长你我一同上马，回转新野，改日再来。,SanGuMaoLu (2).csv,18,0.55
关羽,同白,大哥！,SanGuMaoLu (2).csv,2,0.55
关羽,白,兄长！,SanGuMaoLu (2).csv,2,0.55
关羽,唱,"兄长常礼太恭敬，
旁人闻知恐笑声。
某想卧龙欺人甚，
打量不过是虚名。
腹内并无真学问，
二次不见为何情？
兄长为国理当正，
来往奔驰受辛勤。
冲风冒雪弟难忍，
兄长只想他一人。
今日又想去相聘，
弟同兄长一路行。",SanGuMaoLu (2).csv,84,0.42000000000000004
关羽,白,兄长如此敬贤，不亚于文王见太公了！,SanGuMaoLu (2).csv,15,0.55
关羽,白,贤弟休要造次！,SanGuMaoLu (2).csv,6,0.55
关羽,同唱,兄长分派怎敢迟。,SanGuMaoLu (2).csv,7,0.55
关羽,同白,还礼。先生请坐！,SanGuMaoLu (2).csv,6,0.9
关羽,内同白,来也！,sangumaolu (3).csv,2,0.55
关羽,念,赤胆忠心扶炎汉，,sangumaolu (3).csv,7,0.9
关羽,同白,参见大哥！,sangumaolu (3).csv,4,0.55
关羽,同白,谢座！,sangumaolu (3).csv,2,0.9
关羽,同白,大哥呼唤，有何吩咐？,sangumaolu (3).csv,8,0.55
关羽,白,大哥言得极是，弟愿前往！,sangumaolu (3).csv,10,0.55
关羽,同白,啊！带马伺候！,sangumaolu (3).csv,5,0.55
关羽,西皮散板,卧龙岗上何处寻？,sangumaolu (3).csv,7,0.55
关羽,白,啊！大哥！先生既不在庄上，你我弟兄暂且回去。差人前来，探听先生归期之日，你我弟兄再来！,sangumaolu (3).csv,36,0.55
关羽,白,大哥！回去吧！,sangumaolu (3).csv,5,0.55
关羽,西皮原板,风吹酒味香扑面，,sangumaolu (3).csv,7,0.55
关羽,同白,三弟！,sangumaolu (3).csv,2,0.55
关羽,白,大哥请！,sangumaolu (3).csv,3,0.55
关羽,同白,大哥！,sangumaolu (3).csv,2,0.55
关羽,同白,听见什么？,sangumaolu (3).csv,4,0.55
关羽,白,大哥！今日来得倒也凑巧！,sangumaolu (3).csv,10,0.55
关羽,同白,好好好！,sangumaolu (3).csv,3,0.55
关羽,白,大哥来了！,sangumaolu (3).csv,4,0.55
关羽,同白,是！,sangumaolu (3).csv,1,0.55
关羽,西皮散板,"三弟不可太莽撞，
愚兄言来听端详。",sangumaolu (3).csv,14,0.55
关羽,白,三弟！,sangumaolu (3).csv,2,0.55
关羽,白,大哥访贤不易，你我弟兄不可违背大哥。回转县衙，再来相劝大哥，也就是了。,sangumaolu (3).csv,30,0.55
关羽,白,这……哦！三弟！,sangumaolu (3).csv,4,0.55
关羽,白,你看大哥已然去远，,sangumaolu (3).csv,8,0.55
关羽,同白,大哥哇！,sangumaolu (3).csv,3,0.55
关羽,白,啊！大哥！你我弟兄三人前去相访先生，已有两次不见其人。莫非他空有虚名，无有实学，故避而不见？,sangumaolu (3).csv,39,0.55
关羽,内同白,噢！来了！,sangumaolu (3).csv,3,0.55
关羽,同白,哦！好好好！,sangumaolu (3).csv,4,0.55
关羽,同白,参见先生！,sangumaolu (3).csv,4,0.55
关羽,同白,夸奖了！,sangumaolu (3).csv,3,0.55
关羽,同念,冲锋对垒起战征，谁不闻名胆怕惊。,SanGuMaoLu.csv,14,0.55
关羽,同白,有坐。,SanGuMaoLu.csv,2,0.55
关羽,白,此事必要请出先生，大家商议。,SanGuMaoLu.csv,12,0.55
关羽,白,想管乐是何等人物，竟言孔明才过其人，真乃是一派诳言。,SanGuMaoLu.csv,23,0.9
关羽,唱,"适才听得一番话，
倒叫关某怒气发。",SanGuMaoLu.csv,14,0.1
关羽,白,三弟请坐。,SanGuMaoLu.csv,4,0.55
关羽,白,想那管仲，曾在齐国，相桓公，霸诸侯，一匡天下；那乐毅扶燕伐齐，一日曾下七十二城。此二人，皆战国时有名将相。孔明何如人，焉能比得？,SanGuMaoLu.csv,53,0.7000000000000001
关羽,白,弟恐那道人，言过其实。,SanGuMaoLu.csv,9,0.1
关羽,白,弟遵命。,SanGuMaoLu.csv,3,0.55
关羽,白,大哥不如且回，使人前来探听，几时回来，你我再来不迟。,SanGuMaoLu.csv,22,0.55
关羽,白,岂敢。,SanGuMaoLu.csv,2,0.55
关羽,集贤宾,"论男儿，壮怀须自吐，
岂空向那昊天呼。
笑他们似堂间处燕，
有谁能屋上瞻乌。
不提防柙虎樊熊，
任纵横社鼠城狐。
曾几番听鸡鸣，
起身独夜舞。
想古来多少乘除，
显得动名垂宇宙，肩担日月，把汉室扶。",SanJieYi.csv,77,0.9
关羽,念,壮怀磊落气轩昂，豪杰英雄岂寻常。只眼放开天地小，双眉倒竖血腥香。,SanJieYi.csv,28,0.5
关羽,白,俺，姓关名羽，字寿长，乃蒲州解良人氏。学成韬略，满腹经纶，一生落魄，要想作一个顶天立地的男儿，忠义存心，要干一桩定国安邦之事业。怎奈时运不至，未遇机缘，不知何日，才是出头之日也。,SanJieYi.csv,75,0.9
关羽,新水令,"剑横秋水向垂腰，
见不平便闻悲啸。
你看那烟光迷古寺，
塔影挂寒涛。
多少牢骚，
俺心中事，有谁晓？",SanJieYi.csv,38,0.1
关羽,白,"来此已是酒楼，待我沽饮几杯。
酒家哪里？",SanJieYi.csv,16,0.55
关羽,白,看酒来。,SanJieYi.csv,3,0.55
关羽,梧叶儿,"俺非是爱酒的闲陶令，
又不是使酒的莽灌夫。
似这等，痛饮兴豪粗，
撑着这醒眼儿。
谁瞅睬，问醉乡深，可容得吾，
听街市凭喧呼。
偏冷落，高阳一酒徒。",SanJieYi.csv,57,0.1
关羽,白,老头儿，你姓甚名谁，到此何事，一一讲来。,SanJieYi.csv,16,0.55
关羽,白,竟有这等之事！你为何不去叩告于他？,SanJieYi.csv,15,0.55
关羽,白,既然如此，待俺随你前去叩告。,SanJieYi.csv,12,0.55
关羽,柳叶儿,"不由人冷飕飕，冲冠发竖，
热烘烘气满胸脯。
咭当当把腰间宝刀频频抚。",SanJieYi.csv,28,0.55
关羽,白,你随俺来——,SanJieYi.csv,4,0.55
关羽,柳叶儿,"随定俺，到官衙，把冤情来诉，
管叫你那时节，把悲苦情消除。",SanJieYi.csv,23,0.1
关羽,白,来此已是官衙，前去击鼓喊冤。,SanJieYi.csv,12,0.1
关羽,白,慢着。那张继昌身犯何罪？,SanJieYi.csv,10,0.1
关羽,白,他欠借银款，有何为证？,SanJieYi.csv,9,0.55
关羽,白,既有文约，取来我看。,SanJieYi.csv,8,0.55
关羽,白,你且念来。,SanJieYi.csv,4,0.55
关羽,白,老头儿，既有你亲笔文约，怎说是无有此事？,SanJieYi.csv,17,0.55
关羽,白,你可能当堂再写一张？,SanJieYi.csv,9,0.55
关羽,白,"好，你速速写来。
现有张继昌亲笔，所写文约一张。拿来一对，便知真假。",SanJieYi.csv,27,0.55
关羽,三笑,哈哈！哈哈！吓哈哈哈哈哈！,SanJieYi.csv,10,0.55
关羽,白,看这两张字据的笔迹不同，分明是假造讹诈。想你既为民之父母，就该为百姓分忧解难。怎么，你反助纣为虐，欺诈子民？该当何罪？,SanJieYi.csv,51,0.7000000000000001
关羽,白,你是何人？通上名来。,SanJieYi.csv,8,0.55
关羽,白,你就是熊祥？,SanJieYi.csv,5,0.9
关羽,白,你父子在此处，横行霸道，欺压良民，伤害百姓。今日遇着了某家，也算得是天理循环，报应到了。,SanJieYi.csv,37,0.55
关羽,白,"某姓关名羽，字寿长。想你既为民之父母，反助恶人，欺压良民，要你何用！看刀。
老头儿，此处你父女住不得了，快快去至他乡，避祸去罢。",SanJieYi.csv,52,0.5
关羽,白,趁此四面无人，我不免逃出城去，便了。,SanJieYi.csv,15,0.55
关羽,白,"且住。某家逃出城来，只是后面有人，紧紧追赶，如何是好？
“玄武祠”。我不免进得庙去，藏躲一时，再作道理。
待我将庙门紧闭。",SanJieYi.csv,47,0.9
关羽,白,"多蒙神圣搭救，待我谢过！
外面人声喧嚷，待我开门看来。",SanJieYi.csv,22,0.9
关羽,白,某姓关名羽，字云长，你是何人？,SanJieYi.csv,12,0.55
关羽,白,哦，你就是熊虎，某家正要寻你。你在此处，欺害黎民，骚扰地方，以势力压人。今日遇着关某，可算得报应到了。,SanJieYi.csv,42,0.9
关羽,白,关某叩谢神圣救命之恩！弟子去也。,SanJieYi.csv,14,0.9
关羽,白,那一汉子，在此讲些什么？,SanJieYi.csv,10,0.55
关羽,白,你在此讲些什么？,SanJieYi.csv,7,0.55
关羽,白,似你这样穷酸，怎能出得什么力？,SanJieYi.csv,13,0.55
关羽,白,分明是一个狂徒。,SanJieYi.csv,7,0.9
关羽,西皮摇板,"来至街前用目看，
又见招帖在门前。",SanJieYi.csv,14,0.55
关羽,白,原来是一座肉铺，门前贴有招帖一张，待我看来：,SanJieYi.csv,19,0.55
关羽,念,“豪杰欲招贤，诸君请细观。举起千斤石，切肉不要钱。”,SanJieYi.csv,20,0.55
关羽,白,就是这一块顽石，待我来试他一试。,SanJieYi.csv,14,0.55
关羽,三笑,哈哈，哈哈，哈哈哈哈。,SanJieYi.csv,8,0.55
关羽,白,可有好肉么？,SanJieYi.csv,5,0.55
关羽,白,正是。,SanJieYi.csv,2,0.9
关羽,白,这有多少？,SanJieYi.csv,4,0.55
关羽,白,招帖之上，写的明白，要的什么钱？,SanJieYi.csv,13,0.9
关羽,白,你这招帖之上，写的是举起千斤石，切肉不要钱。,SanJieYi.csv,19,0.55
关羽,白,我已将石举起，就是不能给钱。,SanJieYi.csv,12,0.55
关羽,白,不走便怎样？,SanJieYi.csv,5,0.55
关羽,白,怎么？你还要较量么？,SanJieYi.csv,8,0.55
关羽,白,如此来。,SanJieYi.csv,3,0.55
关羽,白,我在前面酒楼等候。若有人不服，叫他前去见我。来者君子，不来是小人。俺去也。,SanJieYi.csv,31,0.9
关羽,白,酒家。,SanJieYi.csv,2,0.55
关羽,白,将肉打在锅内。,SanJieYi.csv,6,0.1
关羽,白,你只管的做来。,SanJieYi.csv,6,0.55
关羽,白,原来是二位壮士。请坐。,SanJieYi.csv,9,0.9
关羽,白,某姓关名羽，字云长，乃山西解良人氏。请问二位，贵姓高名？,SanJieYi.csv,23,0.55
关羽,白,原来是方、于二位，不知意欲何往？,SanJieYi.csv,13,0.55
关羽,白,天下刀兵四起，遍地黄巾贼寇。只恐途中阻滞，不能得过罢。,SanJieYi.csv,23,0.1
关羽,白,二位莫若，在此少住几日，探听路径。少为平定，再解不迟。,SanJieYi.csv,22,0.55
关羽,白,店家，此处可有大酒楼？,SanJieYi.csv,9,0.55
关羽,白,二位，我等明日到那里畅饮一回。,SanJieYi.csv,13,0.9
关羽,白,店家取酒来。,SanJieYi.csv,5,0.55
关羽,白,看此人好似在哪里见过一面。哦，是了。那日在城门以外观榜就是此人。,SanJieYi.csv,28,0.55
关羽,白,请了。,SanJieYi.csv,2,0.55
关羽,白,仁兄请来，同饮几杯。,SanJieYi.csv,8,0.9
关羽,白,取酒来。,SanJieYi.csv,3,0.55
关羽,白,请！,SanJieYi.csv,1,0.55
关羽,白,你这厮，好生无礼。你分明张贴招帖，上写举起千斤石，切肉不要钱。某家将石举起，你缘何还要肉钱？,SanJieYi.csv,39,0.9
关羽,白,某家曾经举起过的。,SanJieYi.csv,8,0.55
关羽,白,你若想饮酒，何不在此同饮？,SanJieYi.csv,11,0.55
关羽,白,不须客气。请饮就是。,SanJieYi.csv,8,0.55
关羽,白,请了。,SanJieYi.csv,2,0.55
关羽,白,某姓关名羽，字云长，乃山西蒲州解良人氏。,SanJieYi.csv,17,0.55
关羽,白,只因在原郡，打抱不平，伤了人命，是以逃在此地。尚未请教。,SanJieYi.csv,23,0.1
关羽,白,好！酒保，此处可有敞亮之处？,SanJieYi.csv,11,0.9
关羽,白,刘穷在此睡着，且莫管他。我等一同前去。,SanJieYi.csv,16,0.55
关羽,白,此处到好，快取酒来。,SanJieYi.csv,8,0.55
关羽,白,请。,SanJieYi.csv,1,0.55
关羽,西皮摇板,桃园把盏多欢畅。,SanJieYi.csv,7,0.55
关羽,白,好，花拳。,SanJieYi.csv,3,0.55
关羽,白,八骏马。,SanJieYi.csv,3,0.55
关羽,白,请来共饮。,SanJieYi.csv,4,0.55
关羽,白,请了。,SanJieYi.csv,2,0.55
关羽,西皮原板,三人共坐饮琼浆，,SanJieYi.csv,7,0.55
关羽,西皮原板,看刘穷倒不像饥饿模样，,SanJieYi.csv,10,0.55
关羽,西皮原板,因何故落至在长街上，,SanJieYi.csv,9,0.55
关羽,白,"待我看来。
果然不错。看此人相貌非凡，既现龙形，日后定然大富大贵。不免将他唤醒，详细问问他的来历。",SanJieYi.csv,41,0.55
关羽,白,倒要请教。,SanJieYi.csv,4,0.55
关羽,白,原来是汉室苗裔，皇室之胄，失敬了。,SanJieYi.csv,14,0.55
关羽,同白,结拜甚好，我等情愿。,SanJieYi.csv,8,0.9
关羽,白,我是大哥。,SanJieYi.csv,4,0.55
关羽,同白,好。我等前去爬来。,SanJieYi.csv,7,0.55
关羽,白,好，就此而论。酒家，你替我代买乌牛一只，白马一匹，明日准备香烛，就此结义便了。,SanJieYi.csv,32,0.9
关羽,白,大家请至店房一叙。,SanJieYi.csv,8,0.55
关羽,同白,谢坐！,SanQiuJi.csv,2,0.9
关羽,白,大哥！,SanQiuJi.csv,2,0.55
关羽,同白,遵命！,SanQiuJi.csv,2,0.55
关羽,同白,迎接（大哥）（主公）！,SanQiuJi.csv,6,0.55
关羽,同白,遵命！,SanQiuJi.csv,2,0.55
关羽,白,参见大哥！,SanQiuJi.csv,4,0.55
关羽,同白,谢坐！,SanQiuJi.csv,2,0.9
关羽,白,大哥去往荆州，那刘景升怎样动静？,SanQiuJi.csv,14,0.55
关羽,白,原来如此！,SanQiuJi.csv,4,0.55
关羽,同白,主公请！,SanQiuJi.csv,3,0.55
关羽,同白,先生请！,SanQiuJi.csv,3,0.55
关羽,同笑,啊哈哈哈……,SanQiuJi.csv,4,0.55
关羽,同白,啊！,SanQiuJi.csv,1,0.55
关羽,同白,谢军师！,SanQiuJi.csv,3,0.9
关羽,同白,啊！,SanQiuJi.csv,1,0.55
关羽,同白,遵命！,SanQiuJi.csv,2,0.55
关羽,同白,有！,SanQiuJi.csv,1,0.55
关羽,同白,得令！,SanQiuJi.csv,2,0.55
关羽,西皮摇板,桃园威名天下扬，,SanRangXuZhou.csv,7,0.9
关羽,同白,参见大哥。,SanRangXuZhou.csv,4,0.55
关羽,同白,有坐。,SanRangXuZhou.csv,2,0.55
关羽,白,想那曹、陶二家现已罢兵，你我弟兄也好转回平原。,SanRangXuZhou.csv,20,0.55
关羽,同白,陶府君设筵相邀，我等何以克当。,SanRangXuZhou.csv,13,0.55
关羽,同白,请。,SanRangXuZhou.csv,1,0.55
关羽,白,既是陶公再三相让，情意殷殷，兄长暂为应允亦无不可。,SanRangXuZhou.csv,22,0.55
关羽,同白,酒已够了，我等告辞。,SanRangXuZhou.csv,8,0.55
关羽,念,抚养众百姓，,SanRangXuZhou.csv,5,0.55
关羽,同白,弟等要随大哥一同前往。,SanRangXuZhou.csv,10,0.55
关羽,西皮摇板,弟兄一同往前进，,SanRangXuZhou.csv,7,0.55
关羽,唱,"听得子龙报一信，
弟兄分兵将兄寻。",ShuiJingZhuang.csv,14,0.9
关羽,白,大哥受惊了！,ShuiJingZhuang.csv,5,0.55
关羽,白,大哥从何处而来？,ShuiJingZhuang.csv,7,0.55
关羽,白,真乃兄之幸也！三弟也带兵寻找兄长，想必就到。,ShuiJingZhuang.csv,19,0.55
关羽,同白,先生！,ShuiJingZhuang.csv,2,0.55
关羽,同白,公子远路而来，少礼请坐。,ShuiJingZhuang.csv,10,0.9
关羽,内白,闲人闪开，车来了。,taoyuanjieyi.csv,7,0.55
关羽,白,"看那旁有一汉子，在那里自言自语，待我向前问来。
那一汉子你在此作甚？",taoyuanjieyi.csv,29,0.55
关羽,白,粘贴榜文，为了何事？,taoyuanjieyi.csv,8,0.55
关羽,白,你便怎么样？,taoyuanjieyi.csv,5,0.55
关羽,白,唔呼呀！原来是个狂生。待我走去。闲人闪开，车过来了。,taoyuanjieyi.csv,21,0.55
关羽,西皮散板,"闷坐店中神不定，
沽饮几杯解烦心。",taoyuanjieyi.csv,14,0.55
关羽,白,三好酒楼。酒保。,taoyuanjieyi.csv,6,0.9
关羽,白,前面带路。,taoyuanjieyi.csv,4,0.55
关羽,同白,此人仪表不凡，倒有些英雄气概。,taoyuanjieyi.csv,13,0.55
关羽,白,快将好酒取来。,taoyuanjieyi.csv,6,0.55
关羽,白,呔！酒保，俺要酒在先，你倒与他们先送上，莫非你这酒馆欺人不成！,taoyuanjieyi.csv,26,0.9
关羽,白,住了！俺与酒保讲话，你在一旁答言，莫非你心中不服？,taoyuanjieyi.csv,21,0.9
关羽,白,我劝你少管。,taoyuanjieyi.csv,5,0.55
关羽,白,呸！着打！,taoyuanjieyi.csv,3,0.1
关羽,同白,此人在哪里见过……,taoyuanjieyi.csv,7,0.55
关羽,同白,哦……,taoyuanjieyi.csv,1,0.55
关羽,白,你可是那观榜的那个汉子？,taoyuanjieyi.csv,11,0.55
关羽,白,正是。,taoyuanjieyi.csv,2,0.9
关羽,白,不敢。是我错了。,taoyuanjieyi.csv,6,0.55
关羽,同白,笑话了。,taoyuanjieyi.csv,3,0.55
关羽,白,请，我的东道。,taoyuanjieyi.csv,5,0.55
关羽,同白,请，干。哈哈哈……,taoyuanjieyi.csv,5,0.55
关羽,白,请问二位兄台尊姓大名？,taoyuanjieyi.csv,10,0.55
关羽,白,刘、张二兄，失敬了。,taoyuanjieyi.csv,7,0.55
关羽,白,小弟姓关名羽字云长，乃蒲州解良人氏。,taoyuanjieyi.csv,16,0.55
关羽,白,前来贸易未遂，俺意欲前去投军，与国家出力报效。,taoyuanjieyi.csv,20,0.55
关羽,白,正合我意。,taoyuanjieyi.csv,4,0.9
关羽,同白,正要拜府。,taoyuanjieyi.csv,4,0.9
关羽,同西皮散板,弟兄巧遇在三好，,taoyuanjieyi.csv,7,0.55
关羽,同白,大哥请上，受小弟一拜。,taoyuanjieyi.csv,9,0.9
关羽,同白,请到桃园一叙。,taoyuanjieyi.csv,6,0.55
关羽,同白,诸位义士。,taoyuanjieyi.csv,4,0.9
关羽,同白,诸位义士驾到，有何见教？,taoyuanjieyi.csv,10,0.9
关羽,同白,虽有此心，但缺良马兵器。,taoyuanjieyi.csv,10,0.55
关羽,白,冷艳锯。,taoyuanjieyi.csv,3,0.55
关羽,同白,多谢众位义士美意，桃园设宴，大家痛饮。请！正是：,taoyuanjieyi.csv,19,0.7400000000000001
关羽,同念,桃园结义刘、关、张。,taoyuanjieyi.csv,7,0.9
关羽,同念,誓扶汉室锦家邦。,taoyuanjieyi.csv,7,0.9
关羽,白,兄长，为人生死，皆有定数。龚都、刘辟造定无常，大限难逃；失去的粮草，无非是身外之物耳。,TouLiuBiao.csv,35,0.55
关羽,唱,"口内连将兄长尊，
小弟言来听分明：
自古创业非容易，
有否有泰有败兴。
桃园芬芳春日胜，
黄菊九月才吐金。
却是一样有根本，
开早发迟有原因。
军家胜败乃常事，
莫灰当初一片心。
小弟相劝兄耐性，
无志之言休出唇。
先寻个栖身心安稳，
再作商量定计行。",TouLiuBiao.csv,99,0.6333333333333333
关羽,白,大哥，如今正在颠沛流离之际，若拿不定主意，岂不前功尽废？此时且先寻个栖身之地，暂时耐守，再图进取立业，才是正理。那些失志之言，再休出口。丈夫之量，能屈能伸；蛟龙之志，可升可隐。何必把否泰成败放心上？,TouLiuBiao.csv,84,0.3666666666666667
关羽,同白,先生，请坐！,TouLiuBiao.csv,4,0.55
关羽,同白,遵命！,TouLiuBiao.csv,2,0.55
关羽,同白,遵命！,TouLiuBiao.csv,2,0.55
关羽,同白,谢刘主！,TouLiuBiao.csv,3,0.9
关羽,同白,刘主夸奖了！,TouLiuBiao.csv,5,0.55
关羽,同白,遵命。,TouLiuBiao.csv,2,0.55
关羽,同白,刘主请！,TouLiuBiao.csv,3,0.55
关羽,同白,请哪！,TouLiuBiao.csv,2,0.55
关羽,同白,大哥言之有理！,TouLiuBiao.csv,6,0.55
关羽,白,大哥，贼兵贼将，被某杀得血水汪洋！,TouLiuBiao.csv,14,0.1
关羽,引子,秉丹心，扫荡烟尘，扶汉室，扭转乾坤。,tuntushan.csv,14,0.9
关羽,念,桃园结拜义同心，纵横天下显奇能。赤胆忠心冲宇宙，扫尽狼烟灭奸臣。,tuntushan.csv,28,0.6333333333333333
关羽,白,某，汉室关。弟兄结义以来，久战疆场，威名远振。某大哥镇守徐州，三弟统兵小沛，某奉大哥重托，保定二嫂，镇守下邳。可恨曹操，上欺天子，下压群臣。闻得曹操带兵攻打徐州，不知大哥胜负如何，也曾命人前去哨探，未见回报。,tuntushan.csv,87,0.5571428571428572
关羽,白,既是徐州逃来的军兵，不可欺压他们，唤他们进帐。,tuntushan.csv,20,0.55
关羽,白,曹操攻破徐州，使君何在？,tuntushan.csv,10,0.55
