角色名,唱法/表演方式,台词,来源文件,字数,情感分
关羽,西皮快板,"酒未寒斩华雄初使宝刀。
过五关斩六将立保皇嫂，
古城下斩蔡阳匹马单刀。
往日威名谁不晓，
可恨诸葛藐吾曹。
奉军令埋伏在华容小道，
今日里主意定捉拿奸曹。",chibi‘aobing·baben.csv,64,0.3666666666666667
关羽,白,"放起烟火，曹贼到此，速报我知。
2黄润甫、金秀山老先生此处皆唱“流水”；何桂山老先生是第一句内唱西皮导板，上唱慢板，转流水。
3亦可唱顶板。
浏览次数：1万0068 ┊ 字数：5795 ┊ 最后更新：2015-06-11
报告错误 ┊ 版权信息
符合 HTML5 标准 · Sectigo 提供的加密证书 · 戏考的 Blog · 联系小豆子 · © 2000 - 2025
独立站点： 中国京剧老唱片 · 梨园 · 听戏谈戏",chibi‘aobing·baben.csv,110,0.9
关羽,内白,住着！,chibi‘aobing·qiben.csv,2,0.55
关羽,念,为杀贪官出蒲东，斩破黄巾立江洪。堂堂汉室英雄将，威威盖世美髯公。,chibi‘aobing·qiben.csv,28,0.2142857142857143
关羽,白,"某，汉寿亭侯关。军师登台点将，诸将俱有差遣，把俺关某一字不提，不免进帐问过。
参见大哥。",chibi‘aobing·qiben.csv,36,0.55
关羽,白,啊师爷！俺关某自随大哥征战多年，未尝落后。今逢大敌，军师却不委用，此是何意？,chibi‘aobing·qiben.csv,32,0.55
关羽,白,有何违碍？愿即见谕。,chibi‘aobing·qiben.csv,8,0.55
关羽,白,军师你好多心哪！曹操虽是重待某家，某已斩颜良、诛文丑，解白马之围，立功报过。今狭路相逢，岂能够轻放。只恐那曹操不走华容而来。,chibi‘aobing·qiben.csv,53,0.1
关羽,白,愿赌项上人头。,chibi‘aobing·qiben.csv,6,0.55
关羽,白,愿立军状。,chibi‘aobing·qiben.csv,4,0.55
关羽,白,"关某乎！
军状呈上。",chibi‘aobing·qiben.csv,7,0.55
关羽,白,那曹操望见烟火，知有埋伏，如何肯来？,chibi‘aobing·qiben.csv,15,0.55
关羽,白,得令。,chibi‘aobing·qiben.csv,2,0.55
关羽,引子,"想当年弟在范阳、兄在楼桑，
俺关某在蒲州解良，诸葛在南阳，英雄聚四方，结义桃园皇叔关张。",dandaofuhui (2).csv,37,0.9
关羽,念,曹操胁主占中原，孙氏东吴已敷传。天下三分成鼎足，大哥仁义坐西川。,dandaofuhui (2).csv,28,0.9
关羽,白,"某，汉室关羽。奉大哥之命，镇守荆州，东扼下游，北拒郧襄；闻得大哥领西川，进位汉中，也曾奉表申贺，前者诸葛瑾入川催讨荆州，大哥愿将长沙三郡交还东吴，俺想汉朝疆土，岂肯让人，被某拒绝，量孙权必不休，须要提防。
左右，伺候了。",dandaofuhui (2).csv,91,0.55
关羽,白,下书人何在？,dandaofuhui (2).csv,5,0.55
关羽,白,周将。,dandaofuhui (2).csv,2,0.55
关羽,白,搜检明白，叫他报门而进。,dandaofuhui (2).csv,10,0.9
关羽,白,那一下书人，奉何人所差？,dandaofuhui (2).csv,10,0.55
关羽,白,你叫什么名字？,dandaofuhui (2).csv,6,0.55
关羽,白,大胆黄文！你的胆有多大？,dandaofuhui (2).csv,10,0.55
关羽,白,周将。,dandaofuhui (2).csv,2,0.55
关羽,白,剖开看来。,dandaofuhui (2).csv,4,0.55
关羽,白,哈哈哈哈。周将，命他将书呈上。,dandaofuhui (2).csv,12,0.55
关羽,白,"待某拆开一观。
黄文！",dandaofuhui (2).csv,8,0.55
关羽,白,本月十三日，某亲来赴会，修书不及，回话去罢！,dandaofuhui (2).csv,18,0.55
关羽,白,那鲁子敬相请为父，过江赴宴。必为讨荆州之事。,dandaofuhui (2).csv,19,0.55
关羽,白,他既相请，焉有不去之理。我若不去，岂不被东吴耻笑？,dandaofuhui (2).csv,21,0.55
关羽,白,嗯！孺子竟敢多言！为父驰骋在万马军中，尚且视同儿戏，东吴纵有奸谋，为父又何惧哉！,dandaofuhui (2).csv,34,0.1
关羽,西皮二六板,"两朝相隔汉阳江，
鲁子敬排宴不寻常。
哪里有倾杯葡萄酿，
分明是巴豆和砒霜。
玳筵前摆列的英雄将，
休想是画堂别样好风光。
他准备着天罗与地网，",dandaofuhui (2).csv,59,0.9
关羽,西皮流水板,"他准备着杀人好战场。
既相请我当亲身往，
猛虎何惧犬和羊！",dandaofuhui (2).csv,24,0.26
关羽,白,"某自有安排。
周仓听令。",dandaofuhui (2).csv,9,0.9
关羽,白,准备大船一只，挑选关西大汉二十名，随某单刀赴会。,dandaofuhui (2).csv,21,0.55
关羽,白,关平听令。,dandaofuhui (2).csv,4,0.55
关羽,白,准备战船二十只，军卒三千名，埋伏陆口对岸江上，见红旗一摆，即来迎接为父。,dandaofuhui (2).csv,31,0.55
关羽,白,马良、伊藉镇守荆州，诸将各守汛地，严加防守。正是：,dandaofuhui (2).csv,20,0.9
关羽,念,云长亲赴单刀会，磊落行藏万古传。,dandaofuhui (2).csv,14,0.55
关羽,白,可曾齐备？,dandaofuhui (2).csv,4,0.55
关羽,白,吩咐开船。,dandaofuhui (2).csv,4,0.55
关羽,白,周仓。吩咐风帆不用扯满，把船缓缓而行，某家好观看江景。,dandaofuhui (2).csv,23,0.55
关羽,念,波涛滚滚渡江东，独赴单刀孰与同。片帆瞬息西风力，要向东吴一逞雄。,dandaofuhui (2).csv,28,0.55
关羽,白,好—派江景也！,dandaofuhui (2).csv,5,0.55
关羽,上字调新水令,"大江东去浪千叠，
趁西风驾着这小舟一叶。
又不比九重龙凤阙，
早来探千丈虎狼穴。
大丈夫性烈，大丈夫性烈，
觑着那单刀会赛村社。",dandaofuhui (2).csv,52,0.9
关羽,白,前面是何处？,dandaofuhui (2).csv,5,0.55
关羽,白,"待我看来。
哦哈呀，看这边厢山连着水，那边厢水连着山，俺想二十年前隔江斗智，曹兵八十三万人马屯在这赤壁之间，也是这般山水，到今日……",dandaofuhui (2).csv,56,0.9
关羽,驻马听,"依旧的水涌山叠，
依旧的水涌山叠，
好一个年少周郎恁在何处也，
不觉的灰飞烟灭，
可怜黄盖暗伤嗟，
破曹樯橹却又早一时绝。
只这鏖兵江水犹然热，
好教俺心惨切。",dandaofuhui (2).csv,65,0.1
关羽,白,周仓。,dandaofuhui (2).csv,2,0.55
关羽,驻马听,这是二十年流不尽英雄血。,dandaofuhui (2).csv,11,0.1
关羽,白,大夫。,dandaofuhui (2).csv,2,0.55
关羽,白,大夫请。,dandaofuhui (2).csv,3,0.55
关羽,白,还是大夫请。,dandaofuhui (2).csv,5,0.55
关羽,同白,你我携手而行。,dandaofuhui (2).csv,6,0.55
关羽,白,大夫，想某有何德能，敢劳大夫酒筵相迎。,dandaofuhui (2).csv,16,0.9
关羽,白,贱脚踹贵地。,dandaofuhui (2).csv,5,0.55
关羽,白,岂敢。,dandaofuhui (2).csv,2,0.55
关羽,白,使得。,dandaofuhui (2).csv,2,0.55
关羽,白,大夫，可知主不饮……,dandaofuhui (2).csv,7,0.55
关羽,白,酒不饮单。,dandaofuhui (2).csv,4,0.55
关羽,白,请。,dandaofuhui (2).csv,1,0.55
关羽,白,大夫，可知某的刀也会饮酒？,dandaofuhui (2).csv,11,0.55
关羽,白,"看刀！
刀吓，刀！想你在百万军中，取上将首级如探囊取物，今日蒙东吴鲁大夫请某饮宴，你也得痛饮一杯！",dandaofuhui (2).csv,41,0.1
关羽,白,少间席上多饮几杯。,dandaofuhui (2).csv,8,0.55
关羽,白,这却不敢！,dandaofuhui (2).csv,4,0.55
关羽,白,大夫请。,dandaofuhui (2).csv,3,0.55
关羽,白,当阳。,dandaofuhui (2).csv,2,0.55
关羽,白,果然好疾也！唔。,dandaofuhui (2).csv,6,0.1
关羽,胡十八,"想古令立勋业，
哪里有舜五人，汉三杰。
两朝相隔，
只这数年别，
不复能够会也，
恰又早这般老也。",dandaofuhui (2).csv,37,0.55
关羽,白,皆然。,dandaofuhui (2).csv,2,0.55
关羽,白,请。,dandaofuhui (2).csv,1,0.55
关羽,胡十八,开怀来饮数杯。,dandaofuhui (2).csv,6,0.55
关羽,白,大夫！,dandaofuhui (2).csv,2,0.55
关羽,胡十八,某只待要尽兴儿，可便醉也。,dandaofuhui (2).csv,11,0.55
关羽,同白,请！,dandaofuhui (2).csv,1,0.55
关羽,白,大夫提起此事，说来十分平常，听来倒也惊人，大夫若不嫌絮烦，侍某出席，试说与大夫听。,dandaofuhui (2).csv,35,0.55
关羽,白,大夫听道：汉室倾颓，国运衰微，十常侍乱于宫中，众诸侯纷争边外，董卓专权，欺君罔上，关某在汜水关下斩了华雄，虎牢关前三战吕布。平灭董卓之后，我大哥原是帝胄，被当今天子封为宜城侯。谁想又遭曹操之乱，我弟兄逃出许昌，赚城斩了车胄，占了徐州，招军买马。准备重整汉基，那曹操亲领人马前来攻打。我大哥镇守徐州，三弟镇守小沛，关某保定二嫂分镇下邳，以为犄角之势。那日探马报道：徐州、小沛相继失守，关某中了夏侯惇诱敌之计，被困在土山之上。远望下邳火起，只道二嫂遇害，欲待拔剑自刎，山下来了张辽顺说关某。某也曾约过三事：第一件，只降汉，不降曹操；第二件，我二位嫂嫂要食皇叔的俸禄，上下人等，不准到门；第三件，若知我兄下落，不拘千里万里，水火之中，定当辞去。自进曹营以来，那曹操十分厚待于某，三日一小宴，五日一大宴，上马献金，下马赠银。到后来，河北袁绍差大将颜良攻取白马坡，曹营诸将不是颜良对手，关某匹马单刀，我就冲下山去，见了颜良，我勒马提刀——,dandaofuhui (2).csv,355,0.26
关羽,白,不慌。,dandaofuhui (2).csv,2,0.55
关羽,白,一些儿不忙。关某的青龙刀下，就斩了颜良，延津渡口又诛了文丑。表封汉寿亭侯。,dandaofuhui (2).csv,32,0.1
关羽,白,些须微事，何劳大夫谬赞耳！,dandaofuhui (2).csv,11,0.55
关羽,同笑,啊，哈哈哈……,dandaofuhui (2).csv,4,0.55
关羽,白,嗯！关某出世以来，未遇过三合之战将，纵然有诈，关某何惧。,dandaofuhui (2).csv,23,0.1
关羽,白,大夫提起此事，待关某卸去袍服，手舞足蹈，讲与大夫听。,dandaofuhui (2).csv,22,0.55
关羽,白,周将。,dandaofuhui (2).csv,2,0.55
关羽,白,宽袍！,dandaofuhui (2).csv,2,0.9
关羽,白,大夫听了：曹操虽然待我恩厚，只因关某有言在先，若知我兄下落，不拘千里万里，赴汤蹈火，定当辞去。确知我家大哥现在河北袁绍军中，关某肝肠寸断，即往相府辞曹，谁知曹操故意挂出回避牌，张辽又托病不出，关某只得封金挂印，写柬辞曹。行至在灞陵桥，哗喇喇人声呐喊，曹操带领众将前来送行，赠某美酒红袍；这酒，祭了青龙刀，这刀，刀挑大红袍，保定二位皇嫂，闯过了灞陵桥，曹操不与我文凭路引，关关都有阻拦，关某情急无奈，只得斩关杀将，在黄河渡口斩了秦琪，不分昼夜，行至古城。,dandaofuhui (2).csv,195,0.30000000000000004
关羽,白,这说弟兄相会，谁知三弟在敌楼之上言道：红脸的，你既降曹，又来则甚？,dandaofuhui (2).csv,28,0.55
关羽,白,大夫啊！,dandaofuhui (2).csv,3,0.55
关羽,胡十八,"啊呀，大夫。
好教俺混身是口，
恁的样分说？
脑背后将军猛烈，
那素白旗上，他就明明的这标写。",dandaofuhui (2).csv,36,0.9
关羽,白,追赶前来者，乃是蔡阳。,dandaofuhui (2).csv,9,0.55
关羽,白,这因黄河渡口，斩了他外甥秦琪，因此前来与他外甥报仇。我三弟不知，以我带领曹兵里应外合，是某再三分辩，他执意不肯开城，倒也粗中有细，念在桃园之义，助俺三通战鼓，十面小旗。这一通鼓，饱餐战饭；二通鼓，催马阵前；三通鼓，立斩蔡阳。,dandaofuhui (2).csv,95,0.5
关羽,胡十八,"只听得扑通通鼓声耳未绝，
哗喇喇征鞍上骤也。
卒律律刀过处似雪，
叱咤人头落也。",dandaofuhui (2).csv,33,0.55
关羽,白,大夫啊！,dandaofuhui (2).csv,3,0.55
关羽,胡十八,才能够兄弟哥哥每欢悦。,dandaofuhui (2).csv,10,0.55
关羽,白,某的青龙刀啸。,dandaofuhui (2).csv,6,0.55
关羽,白,还不是要取上将的人头落地！,dandaofuhui (2).csv,12,0.55
关羽,白,响过三次。,dandaofuhui (2).csv,4,0.55
关羽,白,温酒斩华雄。,dandaofuhui (2).csv,5,0.1
关羽,白,斩颜良，诛文丑。,dandaofuhui (2).csv,6,0.1
关羽,白,"这三——
啊啊啊！莫非要应在大夫身上了！",dandaofuhui (2).csv,15,0.55
关羽,白,言重了，哈哈哈……,dandaofuhui (2).csv,6,0.55
关羽,白,叫做：以德报德，以直报怨。,dandaofuhui (2).csv,10,0.5
关羽,白,嗯……,dandaofuhui (2).csv,1,0.55
关羽,白,某大哥，乃仁德之君，岂能失信于你？,dandaofuhui (2).csv,14,0.9
关羽,白,啊！今日请某饮宴，就是为了索取荆州么？,dandaofuhui (2).csv,16,0.55
关羽,白,嗯！大夫！,dandaofuhui (2).csv,3,0.55
关羽,庆东原,"我把你真心儿待，
恁将那筵席来设，
攀今弔古，分什么枝叶？
俺跟前使不得之乎者也，诗云子曰。",dandaofuhui (2).csv,37,0.55
关羽,白,住口！,dandaofuhui (2).csv,2,0.55
关羽,庆东原,但开言，只叫恁剜口绝舌！,dandaofuhui (2).csv,10,0.55
关羽,白,恰又来！,dandaofuhui (2).csv,3,0.55
关羽,庆东原,有意孙刘，目下反成吴越。,dandaofuhui (2).csv,10,0.55
关羽,白,嗯！我与大夫谈论国家大事，何用你来多口！站下。,dandaofuhui (2).csv,19,0.55
关羽,白,你便怎么样？,dandaofuhui (2).csv,5,0.55
关羽,白,鲁大夫！,dandaofuhui (2).csv,3,0.55
关羽,念,青龙偃月不可挡，万马军中非寻常。筵前再提荆州事，子敬难免刀下亡。,dandaofuhui (2).csv,28,0.1
关羽,雁儿落带得胜令,"凭着恁三寸不烂舌，
休恼俺三尺无情铁。
这刀饥餐了上将头，
渴饮了仇人血。
这的是龙在鞘中蛰，
虎向座间歇。
今日个故友重相见，
休教俺弟兄们相间别。",dandaofuhui (2).csv,60,0.1
关羽,白,鲁子敬听者！,dandaofuhui (2).csv,5,0.55
关羽,雁儿落带得胜令,心下休惊怯，好日已西斜。,dandaofuhui (2).csv,10,0.55
关羽,白,周将！,dandaofuhui (2).csv,2,0.55
关羽,雁儿落带得胜令,吾当醉也。,dandaofuhui (2).csv,4,0.55
关羽,白,你可有埋伏？,dandaofuhui (2).csv,5,0.55
关羽,白,你可有诈？,dandaofuhui (2).csv,4,0.55
关羽,白,鲁大夫！,dandaofuhui (2).csv,3,0.55
关羽,揽筝琶,"恰怎生闹吵吵三军列？
有谁人把谁挡拦者？
挡着俺啊，只教你剑下身亡，目前见血。
恁便有张仪口，蒯通舌，哪里去闪遮。",dandaofuhui (2).csv,46,0.1
关羽,揽筝琶,"你且来来来，
好生送某到船上。和你慢慢地分别。",dandaofuhui (2).csv,19,0.9
关羽,白,请大夫过船谢宴。,dandaofuhui (2).csv,7,0.9
关羽,白,大夫，受惊了。,dandaofuhui (2).csv,5,0.55
关羽,煞尾,"承款待，多称谢，
只这两句话儿，
恁可也牢牢记者，
百忙里你不得老兄心，
急切里夺不得汉家业。",dandaofuhui (2).csv,37,0.9
关羽,白,请！,dandaofuhui (2).csv,1,0.55
关羽,引子,"凤眼蚕眉，须苍白，耀武扬威。
秉烛待旦天下仰。展经纶，声震吴魏。",DanDaoFuHui.csv,25,0.9
关羽,念,赤面长髯武艺强，兵机战策腹内藏。青龙、赤兔无人挡，统领雄兵镇荆襄。,DanDaoFuHui.csv,28,0.9
关羽,白,"某，汉寿亭侯。今奉军师之命，镇守荆州一带等处。可恨孙权，每每着人前来讨取荆州。是俺再三不与，那厮定必不能罢休。
周仓，",DanDaoFuHui.csv,49,0.1
关羽,白,传。,DanDaoFuHui.csv,1,0.55
关羽,白,你奉何人所差？,DanDaoFuHui.csv,6,0.55
关羽,白,"呈上来。
你对鲁大夫言道：修书不及，照书行事。",DanDaoFuHui.csv,18,0.55
关羽,白,原来鲁肃前来，邀请某过江饮宴。,DanDaoFuHui.csv,13,0.55
关羽,白,某若不去，岂不被东吴耻笑？,DanDaoFuHui.csv,11,0.55
关羽,白,想某家出兵多年，纵横天下，岂惧那东吴小辈！,DanDaoFuHui.csv,18,0.1
关羽,白,只用大船一只，挑选关西大汉数名，在船中服役。周仓一人跟随。船上插红旗一面，再备白旗一面，暗藏船中。吾儿准备战船二十只，领精兵一千名，在江心伺候。倘若东吴有诈，那时将白旗摆动，吾儿带兵急速接应，料无妨碍也。,DanDaoFuHui.csv,88,0.55
关羽,白,关平儿随为父出兵多年，尚不深悉用兵之道。站立一旁，听为父教训。,DanDaoFuHui.csv,27,0.55
关羽,白,为将帅者，必须要通晓天文，深明地理，熟读兵书，通习战策。统兵出战，更须足智多谋。治兵以纪律为先，临阵以精细为上。统率将士，体恤人心，宽以济猛，猛以济宽；有功则赏，有过者罚。交锋之际，量自己之强弱，查敌人之虚实。有道是：“知彼知己，百战百胜。”乘其未至，攻其不备。运筹帷幄之中，决胜千里之外。诈败不可紧追，得胜不可妄进。安营扎寨，靠山近水。深林防埋伏，苇塘防火攻。战无不胜，攻无不取。此所谓行军之诀也。,DanDaoFuHui.csv,164,0.7400000000000001
关羽,西皮摇板,"用兵之道须谨慎，
临阵交锋要小心。
随机应变莫妄进，
得胜成功休逞能。
因地制宜安了寨，
靠山近水扎大营。
偷营劫寨心拿稳，
旗开得胜把功成。",DanDaoFuHui.csv,56,0.9
关羽,白,"上得船来，好一派江景。
周仓，",DanDaoFuHui.csv,11,0.55
关羽,白,解缆开船。,DanDaoFuHui.csv,4,0.55
关羽,二黄导板,上船来只觉得神清气爽，,DanDaoFuHui.csv,10,0.55
关羽,二黄原板,"推楼窗丹凤眼细看端详：
大舟船千百只均靠岸上，
小舟船密匝匝好似蜂房。
微风起淡云收天晴日朗，
绿澄澄波浪平水接天光。
耳边厢又听得人声喧嚷，
又只见东吴兵排列两厢。
叫仓将，将舟船依靠岸上，",DanDaoFuHui.csv,80,0.55
关羽,二黄摇板,你随某下船去细看端详。,DanDaoFuHui.csv,10,0.55
关羽,白,某家久未致侯，大夫恕罪。,DanDaoFuHui.csv,10,0.1
关羽,白,大夫见召，足见多情。,DanDaoFuHui.csv,8,0.55
关羽,白,请。,DanDaoFuHui.csv,1,0.55
关羽,白,叨扰了。,DanDaoFuHui.csv,3,0.55
关羽,西皮原板,"在吴江与大夫共饮琼浆，
在筵前细听我诉说衷肠：
想当年破黄巾东除西荡，
战吕布，杀文丑，斩却颜良。
数十载动干戈未离马上，
奉主命统大兵坐镇荆襄。
今日里饮酒在临江亭上，
蒙厚意备酒宴甚实叨光。",DanDaoFuHui.csv,80,0.1
关羽,白,大夫若不嫌絮烦，待某手舞足蹈，细讲一番。,DanDaoFuHui.csv,17,0.55
关羽,白,听道：,DanDaoFuHui.csv,2,0.55
关羽,吹腔慢板,"想当年曹营多安享，
为寻兄长出许昌。
挂印封金阳关上，
沿途关口动刀枪。
孔秀、孟坦刀下丧，
韩福、王植马前亡。
普净禅师机关泄漏，
卞喜被某剑劈在庙廊。
黄河渡口将俺阻挡，
刀砍秦琪丧无常。
古城之下摆战场，
擂鼓三通斩蔡阳。",DanDaoFuHui.csv,89,0.30000000000000004
关羽,白,有何金言，当面领教。,DanDaoFuHui.csv,8,0.55
关羽,白,今日饮宴，乃是朋友人情，军国大事，不须提起。,DanDaoFuHui.csv,18,0.55
关羽,白,乃是我的宝刀啸声。,DanDaoFuHui.csv,8,0.55
关羽,白,正是。,DanDaoFuHui.csv,2,0.9
关羽,白,此刀，自某在范阳桃园结拜以来，即有此刀。至今数十余年。连今日，只啸三次。,DanDaoFuHui.csv,30,0.9
关羽,白,也不过是杀人而已。,DanDaoFuHui.csv,8,0.1
关羽,白,"第一次刀啸，应在斩颜良诛文丑；第二次刀啸，应在过五关斩六将；今日刀啸，只恐怕要应在大夫的身上。
周仓，看刀来。
刀吓，青龙刀！想你随某出兵多年，也不知斩了多少上将。今日鲁大夫设宴相邀，在临江亭上饮酒，你也要饮得一杯。",DanDaoFuHui.csv,91,0.1
关羽,吹腔慢板,"青龙偃月白光凝，
能征惯战血染红。",DanDaoFuHui.csv,14,0.1
关羽,白,酒已够了，某家要告辞了。,DanDaoFuHui.csv,10,0.55
关羽,吹腔慢板,"多蒙大夫情意厚，
醉酒饱德意悠悠。
常言三杯和万事，
一醉便能解千愁。",DanDaoFuHui.csv,28,0.6333333333333333
关羽,白,大夫，某深感盛情，多谢了！,DanDaoFuHui.csv,10,0.9
关羽,引子,"绿袍金甲，镇华夏。
秉定忠心，扶保汉家。",dandaohui.csv,15,0.9
关羽,白,站立两厢。,dandaohui.csv,4,0.55
关羽,念,赤兔马快似闪电，青龙刀遮日光寒。守荆州威镇华夏，保大哥驾坐西川。,dandaohui.csv,28,0.9
关羽,白,"某，关羽。大哥坐镇西川，三弟阆中为将，某奉兄命镇守荆州一带。前者，诸葛瑾入川，催讨荆州，我家大哥愿将长沙、零陵、桂阳三郡交还东吴；只因关某不允，将诸葛瑾羞辱一场。我想孙权必不甘休，为此，整顿人马准备御敌。
站堂军。",dandaohui.csv,89,0.1
关羽,白,伺候了。,dandaohui.csv,3,0.55
关羽,白,命他报门而进。,dandaohui.csv,6,0.55
关羽,白,奉何人所差？,dandaohui.csv,5,0.55
关羽,白,到此做甚？,dandaohui.csv,4,0.55
关羽,白,呈上来。帐下伺候。,dandaohui.csv,7,0.55
关羽,白,"鲁肃有书信到来，待某拆书一观。
唤下书人。",dandaohui.csv,17,0.9
关羽,白,命你转报子敬，就说关某五月十三日过江赴会。出帐去吧。,dandaohui.csv,23,0.55
关羽,白,我儿哪里知道，那鲁肃约为父过江赴会，此必诸葛瑾回报孙权，故命鲁肃兵屯陆口，正为索讨荆州之计尔。1,dandaohui.csv,42,0.9
关羽,白,为父若是不前去，岂不被东吴人耻笑？,dandaohui.csv,15,0.55
关羽,白,嗯！孺子竟敢多言。为父在千枪万刃之中，矢石交攻之际，往来如走无人之境，岂惧江东群鼠尔！,dandaohui.csv,37,0.1
关羽,白,某自有差派。,dandaohui.csv,5,0.55
关羽,白,周仓。,dandaohui.csv,2,0.55
关羽,白,准备大船一只，挑选关西大汉二十名，手提青龙刀，随关某单刀赴会。,dandaohui.csv,27,0.55
关羽,白,关平听令。,dandaohui.csv,4,0.55
关羽,白,准备战船二十只，军三千名，扮做商贾模样，埋伏陆口对岸江上，见为父红旗一摆，儿便过得江去，迎接为父。,dandaohui.csv,42,0.55
关羽,白,伊籍、马良。,dandaohui.csv,4,0.55
关羽,白,镇守荆州，须要小心。,dandaohui.csv,8,0.55
关羽,白,王甫、赵累。,dandaohui.csv,4,0.55
关羽,白,巡营嘹哨。,dandaohui.csv,4,0.55
关羽,白,其余将官各守汛地。掩门。,dandaohui.csv,10,0.55
关羽,白,好生防守。,dandaohui.csv,4,0.55
关羽,白,吩咐水手开船。,dandaohui.csv,6,0.55
关羽,白,站立一旁。,dandaohui.csv,4,0.55
关羽,新水令,"大江东去浪千叠，
趁西风小舟一叶；
才离了九重宝帐，
探千丈龙潭虎穴。",dandaohui.csv,28,0.55
关羽,白,什么响亮？,dandaohui.csv,4,0.55
关羽,白,搭坐船头。,dandaohui.csv,4,0.55
关羽,白,唔呼呀！看长江之上，巨浪千叠，好一派江景也！,dandaohui.csv,18,0.55
关羽,喜迁莺,"观江水滔滔浪腾，
波浪中隐隐伏兵，
俺惊也么惊，
凭着俺青龙偃月敌万兵。",dandaohui.csv,29,0.55
关羽,刮地风,"嗳呀……嗳！
观东吴缥缈缈旌旗绕。
恰便似虎入龙潭何计较！",dandaohui.csv,22,0.55
关羽,白,鸣锣呐喊！,dandaohui.csv,4,0.55
关羽,白,大夫。,dandaohui.csv,2,0.55
关羽,白,过江来了！,dandaohui.csv,4,0.55
关羽,同笑,啊，哈哈哈……,dandaohui.csv,4,0.55
关羽,白,大夫前行。,dandaohui.csv,4,0.55
关羽,白,不敢，大夫前行。,dandaohui.csv,6,0.55
关羽,白,岂敢。大夫荣任水军都督，关某未曾亲来一贺，大夫恕罪。,dandaohui.csv,22,0.1
关羽,白,大材终堪大用。,dandaohui.csv,6,0.55
关羽,白,大夫忒谦了。,dandaohui.csv,5,0.55
关羽,白,在临江会一别，直至如今。,dandaohui.csv,10,0.55
关羽,白,彼此。,dandaohui.csv,2,0.55
关羽,同笑,啊，哈哈哈……,dandaohui.csv,4,0.55
关羽,白,锦贴相邀，有何见谕？,dandaohui.csv,8,0.55
关羽,白,关某有何德能，怎敢劳动大夫张筵。,dandaohui.csv,14,0.9
关羽,白,"不敢，摆下就是。
看酒来，我与大夫把盏。",dandaohui.csv,15,0.55
关羽,白,当得的。,dandaohui.csv,3,0.55
关羽,同笑,啊，哈哈哈……,dandaohui.csv,4,0.55
关羽,白,大夫请，大夫请。嗳，大夫请。,dandaohui.csv,10,0.55
关羽,脱布衫接叨叨令,"银台辉煌的丰筵锦，
望江心缥缥缈缈的波涛滚，
看他面色赧然战兢兢，
这的是笑得来也么哥！",dandaohui.csv,37,0.55
关羽,白,请。,dandaohui.csv,1,0.55
关羽,脱布衫接叨叨令,这的是恼得来也么哥！,dandaohui.csv,9,0.55
关羽,白,俺关某所做之事，听者倒也惊人，眼见甚是平常；大夫不嫌絮烦，暂离残席，容关某奉陈。,dandaohui.csv,34,0.1
